<?xml version="1.0" encoding="UTF-8" standalone="yes"?>
<Targets xmlns:xsi="http://www.w3.org/2001/XMLSchema-instance" xsi:noNamespaceSchemaLocation="file:///./deploymentTargets.xsd">
    <Target>
        <name>target1</name>
        <description>local tomcat</description>
		<destType>server</destType>
		<serviceProvider>local</serviceProvider>
        <server>tomcat</server>
		<container></container>
		<dnsHost>localhost</dnsHost>
		<publicIp></publicIp>
		<privateIp></privateIp>
        <port>8080</port>
		<user>manager</user>
		<password>manager</password>
        <OS>windows</OS>
    </Target>
    <Target>
        <name>target2</name>
        <description>CloudFoundry</description>
        <destType>server</destType>
        <serviceProvider>CloudFoundry</serviceProvider>
        <server>cloudfoundry</server>
        <container></container>
        <dnsHost>api.cloudfoundry.com</dnsHost>
        <publicIp></publicIp>
        <privateIp></privateIp>
        <port></port>
        <user></user>
        <password></password>
        <OS>linux</OS>
    </Target>
	<Target>
        <name>target3</name>
        <description>local websphere</description>
		<destType>server</destType>
		<serviceProvider>local</serviceProvider>
        <server>websphere</server>
		<container></container>
		<dnsHost>localhost</dnsHost>
		<publicIp></publicIp>
		<privateIp></privateIp>
        <port>8880</port>
		<user></user>
		<password></password>
        <OS>windows</OS>
    </Target>
</Targets>
